{
  "format": "ultimate-calendar-plan",
  "version": 2,
  "timezone": "Asia/Shanghai",
  "planId": "demo-guarded-supplement-20300417",
  "title": "示例：带上下文校验的四时段补录",
  "basis": {
    "source": {
      "kind": "cloud",
      "dataInstanceId": "11111111-1111-4111-8111-111111111111",
      "generation": 1
    },
    "goalId": "00000000-0000-4000-8000-000000000100",
    "fromDate": "2030-04-15",
    "toDate": "2030-04-21",
    "exportedAt": "2030-04-15T08:00:00+08:00",
    "fingerprint": "84c19d15335f48228ff8d3646184e4b16181b711964b80a90ce8b21c01d79c09"
  },
  "goals": [],
  "tasks": [],
  "resources": [],
  "blocks": [
    {
      "id": "session-3",
      "title": "示例任务 3学习",
      "kind": "work",
      "taskId": "00000000-0000-4000-8000-000000000003",
      "start": "2030-04-17T19:00:00+08:00",
      "end": "2030-04-17T19:45:00+08:00"
    },
    {
      "id": "session-4",
      "title": "示例任务 4学习",
      "kind": "work",
      "taskId": "00000000-0000-4000-8000-000000000004",
      "start": "2030-04-18T19:00:00+08:00",
      "end": "2030-04-18T19:45:00+08:00"
    },
    {
      "id": "session-5",
      "title": "示例任务 5学习",
      "kind": "work",
      "taskId": "00000000-0000-4000-8000-000000000005",
      "start": "2030-04-19T19:00:00+08:00",
      "end": "2030-04-19T19:45:00+08:00"
    },
    {
      "id": "session-6",
      "title": "示例任务 6学习",
      "kind": "work",
      "taskId": "00000000-0000-4000-8000-000000000006",
      "start": "2030-04-20T19:00:00+08:00",
      "end": "2030-04-20T19:45:00+08:00"
    }
  ]
}
